{
  "version": "0.1",
  "artifact": {
    "sha256": "23adf1655e7d647cc2ccc6c2ffe08d60945980f8b3f32459366d8de08754b957",
    "mime": "text/plain",
    "name": "sample.txt",
    "size": 162,
    "created_at": "2025-08-19T00:27:56.906Z",
    "hash_binding": "bytes",
    "byte_size": 162
  },
  "inputs": [
    {
      "type": "source",
      "sha256": "23adf1655e7d647cc2ccc6c2ffe08d60945980f8b3f32459366d8de08754b957",
      "name": "sample.txt",
      "size": 162,
      "role": "input"
    }
  ],
  "steps": [
    {
      "action": "demo-copy",
      "tool": "cp",
      "command": "cp /home/coder/project/provenancepass/examples/artifacts/sample.txt /home/coder/project/provenancepass/examples/artifacts/sample-processed.txt",
      "started_at": "2025-08-19T00:27:56.901Z",
      "ended_at": "2025-08-19T00:27:56.906Z",
      "actor": {
        "type": "software",
        "id": "pp-cli"
      }
    }
  ],
  "policy_checks": [],
  "signature": {
    "algo": "ed25519",
    "public_key": "82387ea8fe5bd33f5e255c89b6358746148c782a8d505092b4b3314c4bff81d9",
    "signature": "b3ed5aec4dee2210958d8935052bdd50bf599b0d8bc4e54ac048582511049e58c9b35fa254bfab157375c1025ac1dd7f9f6819a442fea965928771b50de6f80b",
    "key_id": "ppk_662720ca34fc33ea"
  }
}