{
  "version": "0.1",
  "artifact": {
    "sha256": "4f74c22d41dba2c1695f066d635562731e24eaab3b0e3c2a77de80274fec7af3",
    "mime": "application/octet-stream",
    "name": "document.docx",
    "size": 1388,
    "created_at": "2025-08-19T16:20:41.091Z",
    "hash_binding": "bytes",
    "byte_size": 1388
  },
  "inputs": [
    {
      "type": "source",
      "sha256": "4f74c22d41dba2c1695f066d635562731e24eaab3b0e3c2a77de80274fec7af3",
      "name": "document.docx",
      "size": 1388,
      "role": "input"
    }
  ],
  "steps": [
    {
      "action": "Test vector generation",
      "tool": "true",
      "command": "true",
      "started_at": "2025-08-19T16:20:41.082Z",
      "ended_at": "2025-08-19T16:20:41.091Z",
      "actor": {
        "type": "software",
        "id": "pp-cli"
      }
    }
  ],
  "policy_checks": [],
  "signature": {
    "algo": "ed25519",
    "public_key": "effcf227033fc29ffb5d1501ecc16f61b957ad8626e4cb4d6fa5f68d20628ec1",
    "signature": "bd715d0737d4440426757f86239599a91663aba0c8f3286f96afa1773261027bcc125cb0a9792ee21479f403b9c6a2b9c2fbd953883068543dd76e95a0057c0f",
    "key_id": "ppk_a9855ab4b85fdce5"
  }
}