{
  "version": "0.1",
  "artifact": {
    "sha256": "205439601fec40d7b4d7cae756f29962a543f57def5815823f5bfc361bd260bd",
    "mime": "text/plain",
    "name": "document.txt",
    "size": 23,
    "created_at": "2025-08-19T12:07:11.602Z",
    "hash_binding": "bytes",
    "byte_size": 23
  },
  "inputs": [
    {
      "type": "source",
      "sha256": "205439601fec40d7b4d7cae756f29962a543f57def5815823f5bfc361bd260bd",
      "name": "document.txt",
      "size": 23,
      "role": "input"
    }
  ],
  "steps": [
    {
      "action": "No-op signing",
      "tool": "cp",
      "command": "cp /home/coder/project/provenancepass/examples/assets/document.txt /home/coder/project/provenancepass/examples/out/pass/document.txt",
      "started_at": "2025-08-19T12:07:11.592Z",
      "ended_at": "2025-08-19T12:07:11.602Z",
      "actor": {
        "type": "software",
        "id": "pp-cli"
      }
    }
  ],
  "policy_checks": [],
  "signature": {
    "algo": "ed25519",
    "public_key": "ec5fbfb428ae6f21cad1231ec714ae887d2b70e305c4f4c09e365ccfcb9c1f58",
    "signature": "def3495e254a72975e3a9102e85a86b5b5fc9c21fa280f7812abf822f8a5d8704c860634b4eef20242cc092206d14519e3c2b10025097a5b8b39a93d2796ed0c",
    "key_id": "ppk_5608cddd4082789b"
  }
}