{
  "version": "0.1",
  "artifact": {
    "sha256": "e3b0c44298fc1c149afbf4c8996fb92427ae41e4649b934ca495991b7852b855",
    "mime": "text/plain",
    "created_at": "2024-08-19T15:30:00Z"
  },
  "inputs": [],
  "steps": [],
  "policy_checks": [],
  "signature": {
    "algo": "ed25519",
    "public_key": "d75a980182b10ab7d54bfed3c964073a0ee172f3daa62325af021a68f707511a",
    "signature": "a1b2c3d4e5f67890a1b2c3d4e5f67890a1b2c3d4e5f67890a1b2c3d4e5f67890a1b2c3d4e5f67890a1b2c3d4e5f67890a1b2c3d4e5f67890a1b2c3d4e5f67890"
  }
}